17/04/2020;144/E14130/2020-S0;Percepatan Modifikasi Let Down HHP Steam UTL 500 to HP Steam UTL RFCC ;;;;;;"Emergency Stop Unit Gasoline Treating Unit #105 dan Hidrogen Recovery Unit #108 Untuk menjaga kestabilan pressure HP Steam Header , Start Up RFCC secara Overal 8 Jam lebih lama terkait limitasi availabilitas HP Steam "
05/05/2020;100/E14110/2020-S0;Perbaikan Bocoran ;2101051505;8201028400;3950061241;500025181;PT. INDAH JAYA PUTRA;Akibat Long residue masuk ke kero menyebabkan kenaikan sulfur content dan perubahan warna di kero sebagai feed product avtur (off spec) 
19/05/2020;128/E14110/2020-S9;Perbaikan shaft 11P-23A;1101015312;;;;;Menyebabkan Unit CDU Stop 
08/06/2020;/E14120/2020-S0;Perbaikan Tangki 39T-202;1101015453;8301077294;;;;Dampak Kehandalan : tidak dapat menampung produk Heavy Platformate sebagai umpan unit Xylene Fraksinasi 
09/06/2020;/E14130/2020-S0;Perbaikan kerusakan FD Fan COB 101-F-503-K1;2101052537;;;;;"Potensi RFCC Trip yang mengakibatkan loss produk LPG, Naphta dan Propylene "
09/06/2020;/E14130/2020-S0;Pembuatan Line RBDPO di Area OM 60 ;-;;;;;"33T7 tdk dpt menerima discharge RBDPO dari Kapal, tdk dpt digunakan sbg feed RBDPO ke unit 018 (TDHT), tdk dpt diinjeksikan ke LSWR tank sbg feed RFCC, Program RBDPO sbg feed unit 018 (TDHT) dan Feed RFCC menjadi terkendala"
10/06/2020;071/E14110/2020-S0;Penggantian line MP. Steam Sootblower Boiler 52-B-1/2/3/201 di Unit Utilities -I & Px ;2101047290;;;;;"Kerusakan yang terjadi pada line sootblower boiler berakibat tidak dilakukan sootblowing boiler untuk membersihkan jelaga di tube, akibatnya akan terjadi penurunan performance, efisiensi dan mengurangi minimum spare HP steam boiler secara keseluruhan di Utilities-Prod I "
10/06/2020;/E14120/2020-S0;Perbaikan Line Underground Closed Drain ;2101046926;;;;;Dampak Kehandalan : Tdk dpt melakukan pengedrainan / dekontaminasi secara normal 
16/06/2020;216/E14120/2020-S5;Perbaikan 93XV-063;2101052941;8201030797;;;;Unit 93 (Sulfur Recovery Unit) Stop 
18/06/2020;156/E14130/2020-S0;Penggantian Flame Detector di Aux Boiler (151-B-501B) UTL RFCC;2101051888 dan 2101052927;8201029268;;;;Tidak maksimalnya operational Aux Boiler B dan tidak termonitornya api di burner atas Aux Boiler B. Hal tersebut dapat mengganggu kehandalan kilang RFCC secara keseluruhan karena menurunnya produk steam dari Aux Boiler B 
19/06/2020;220/E14130/2020-S0;Upgrade Line Acid di Polisher 154-A-503 ABC ;2101047538;;;;;"Terganggunya proses regererasi yang berdampak pada kualitas dan penurunan produk Demin Water, sehingga dapat mengganggu balance water di Kilang RFCC. Dari segi safety dapat membahayakan operator Utl RFCC yang bertugas di Polisher "
23/06/2020;75/E14110/2020-S0;Penggantian Silica Sand 16C-1 dan Clay 16C-3 berdasarkan Ref Memo 234/E14200/2020-S2;2101050613;8201029471;3950071548;500025761;PT. BANGUN SEJAHTERA RAHARJA;Target produksi Avtur tidak bisa tercapai 
24/06/2020;221/E14130/2020-S0;Penggantian Modul Komunikasi Kompresor Unit 108;2101053006;8201029437;;;;Dengan terkendalanya kompresor 108-K-501 A berpotensi menyebabkan produksi Avtur Unit 105 terhenti dikarenakan tidak ada suplai gas hydrogen ke unit 105
24/06/2020;74/E14110/2020-S0;Percepatan Perbaikan MLOP 510G601P2A;2101053163;;;;;Kehandalan suplly lube oil 510G601 menjadi berkurang karena tidak beroperasinya MLOP 510G601P2A
29/06/2020;228/E14130/2020-S0;Perbaikan FDF COB 101F-503K2;2101053425;8201029565;;;;"Dengan menunggu perbaikan carbon ring, FDF CO Boiler (combustion air) beroperasi tanpa spare, jika terjadi kegagalan pada 101F-503K1 (Motor) maka akan menyebabkan CO Boiler Trip sehingga steam balance terganggu, berakibat kapasitas RFCC turun (dibawah 100% kapasitas). Apabila kondisi ini tidak segera diselesaikan, maka berpotensi kehilangan produk gasoline 92, LPG serta Propylene. "
30/06/2020;79/E14110/2020-S0 ;Unbalanced Shaft Pompa 11P-2B (Vibrasi Tinggi) ;2101053439;8201029630;;;;"Bila 11P-3 mengalami kegagalan, maka unit CDU harus Stop "
01/07/2020;78/E14110/2020-S0;Perbaikan Pompa Condensate STG 51-P-2 di Utilities-I & Px;2101053471;;;;;"Kerusakan yang terjadi pada pompa Condensate STG 51-P-2 berakibat tidak dapatnya beroperasi Unit Steam Turbin Generator 51-G-2, kondisi aktualnya sekarang beroperasi tanpa pompa condensate yang stand-by. Bila terjadi failure akibatnya akan shut down / trip Unit Steam Turbin Generator 51-G-2"
01/07/2020;243/E14130/2020-S0;Penggantian Valve Discharge Pompa Clarifier 63P502ABC;"2101053543, 2101053544, 2101053545 ";;;;;"Berdasarkan kerusakan tersebut dapat menyebabkan terganggunya operaional pada saat kejadian emergency dikarenkan operator kesulitan dalam mengo[peraikan valve tersebut. Dan selain unsafe condition saat mengoperaikan Valve khususnya 63P502C, juga dapat kami sampaikan terkait kendala pada saat cleaning strainer karena kondisi valve passing."
01/07/2020;005/E14110/2020-S0;Pengecatan Tanki Bagian Luar 33T7 ;2101027550;8301078812;;500025977;;"33T7 kondisi coating yang sudah buram berpotensi terjadi laju korosi yang cepat, dengan adanya laju korosi yang cepat berpotensi roof tanki berlubang / rusak. Apabila roof tanki 33T7  berlubang maka jika terjadi hujan air hujan akan masuk kedalam tanki dan akan mempengaruhi spesifikasi RBDPO di 33T7 & unsafe untuk dioperasikan "
01/07/2020;360/E14110/2020-S0;Percepatan Perbaikan Catwalk 73MD9 Dermaga III Area 70 ;1101015761;8301079234;;500026061;;"Kondisi tidak aman pada saat proses penyandaran, terutama saat dilakukan malam hari.Potensi kerusakan lebih besar pada saat struktur platform 73MD9 dan 73MD10 apabila tdak dilakssanakan pengangkatan dan reposisi Catwalk segera. Potensi tidak dpat disandarakan kapal di Dermaga III"
07/07/2020;83/E14110/2020-S5 ;Percepatan Perbaikan / Pengadaan Shaft Finfan 017E-105 K14 ;2101053262;;;;;Proses Pendinginan temperet water akan terganggu sehingga mengakibatkan temperatur LSWRproduk yang ke tanki akan panas 
07/07/2020;248/E14130/2020-S0;Perbaikan Pompa Decant Oil 101P-523A;2101053782;8201029882;;;;"Dengan menunggu Perbaikan Liner Cassing & Mesh Seal, Pompa Produk DCO (Decant Oil) tersebut beroperasi tanpa spare, berpotensi menyebabkan kegagalan pumping out DCO Main Column Bottom Product yang akan berdampak pada kegagalan Unit 101-RCU serta Unit RFCC total shutdown yang mengakibatkan produksi offgas, gasoline, LPG, Propylene, LCO (Light Cycle Oil) dan DCO (Decant Oil) terhenti, Produk HP Steam dari catalyst cooler hilang sebanyak  120 ton/hr, berkurangnya produk HP Steam dari CO Boiler dari  210 Ton/Hr menjadi hanya 60ton/hr, serta hilangnya produk MP Steam Generator sebanyak 70 ton/hr "
08/07/2020;85/E14110/2020-S0;Percepatan Perbaikan Shaft untuk Rotating Equipment di Fungsi Produksi I;"2101052900 ,2101053471, 2101053321, 2101036758, 2101053262";8201029275;;;;Dengan banyaknya kerusakan Rotating Equiptment di Fungsi Produksi I terutama bagian Shaft dapat menurunkan kehandalan operasi kilang 
08/07/2020;250/E14130/2020-S0;Perbaikan Pompa COS (Carbonyl Sulfide) Circulation Pumps 103P-509A;2101053884;;;;;"Dengan menunggu Perbaikan Impeller & Shaft, Pompa COS Solvent tersebut beroperasi tanpa spare, berpotensi menyebabkan kegagalan sirkulasi COS Solvent yang akan berdampak pada kegagalan Unit 103-Merox yang mengakibatkan kehilangan Produk LPG sebesar 1190 TPD & Propylene sebesar 475 TPD "
08/07/2020;236/E14120/2020-S5;Perbaikan 041P-108A dan B ;2101052345;8201028916;;;;Potensi Blending Asphalt tidak dapat dilaksanakan 
13/07/2020;80/E14110/2020-S0;Percepatan Perbaikan Pompa 70P6 di Oil Movement Area 70 ;2101053321;8201029482;;100032461;;"Terganggunya distribusi air tawar ke gedung-gedung di Area 70, Terganggunya operasional supply ke kapal dikarenakan ada sebagian yang dialirkan ke gedung-gedung "
16/07/2020;87/E14110/2020-S0;Percepatan Perbaikan Switch Rack Metering System Area 70;2101053999;;;;;Kondisi Sub Standardyang menyebabkan kegagalan pengoperasian Metering sebagai Custody Transfer. Potensi shut down Peralatan Metering di area /local yang menyebabkan stop kegiatan loading yang menggunakan metering
21/07/2020;88/E14110/2020-S0;Percepatan Penggantian UPS 200EE0004 Cyberex;1101015944;8301079109;;500025995;;"Potensi jika terjadi kegagalan pada System UPS standby tersebut, maka LOC III akan shutdown. "
21/07/2020;250/E14120/2020-S0;Perbaikan Bocoran Line 88-FL8017-A1A1-30";2101054292;8201030109;;500026067;;"Dampak Kehandalan tekanan operasi terganggunya. Dampak operasional dapat mengakibatkan terganggunya unit proses area Paraxylenekhususnya di Raffinate Colomn (88C-202) unit proses. Dampak Safety : Unsafe condition dan paparan hydrocarbon, karena line yang bocor "
21/07/2020;246/E14120/2020-S5;Cleaning 166 PIT-502;2101054233;;;;;"Repeatable kerusakan pompa 166P-502 AB, potensi oil spill ke perairan terbuka "
24/07/2020;264/E14120/2020-S5;Pengadaan UPS (Uninterruptible Power Supply) Penggantian UPS 200EE004 dan Battery Bank 200EE0005;;;;;;All Unit LOC III Shutdown akibat power failure PLC ESD dari kegagalan Secondary UPS 200EE0004 yang beroperasi tanpa adanya Standby UPS 
27/07/2020;93/;Resizing Jumper Line dari 2" ke 4" sebagai tie-in supply fresh Colling Water ke sistem Jacket Water ;2101054599;;;;;"Ketiadaan supply sistem Jacket Water menyebabkan tidak adanya sistem pendongin pada peralatan berikut sistem pelumas Kompresor, STG, FD Fan Boiler dan potensi Shutdown "
28/07/2020;091/E14110/2020-S0;Perbaikan Valve Bypass 11FV-016 Pass 6 Dapur 11F1;2101054446;8201030126;;;;"Unbalanced beban Pass 6 : Duty MMK cal/hr = 8,41 vs 8,10 design, Flow T/D = 2998 vs 1697 design "
03/08/2020;282/E14130/2020-S0;Perbaikan Bocoran Flange Suction Tangki 47-T-511B ;2101054843;8201030272;;500026118;;Terhambatnya proses loading propylene ke kapal dan berpotensi terjadi kebakaran dikarenakan ada paparan propylene ke udara bebas 
03/08/2020;94/E14110/2020-S0;Perbaikan Pompa Cooling Water 053-P-101C ;2101054250;8201029983;;;;berpotensi mengurangi kehandalan Kilang II (FOC II & LOC II) dan bila Pompa yang beroperasi terjadi kegagalan dapat menyebabkan shutdown FOC II & LOC II 
04/08/2020;266/E14120/2020-S0;Perbaikan Motor 82P201B ;2101054903;8301080653;;500026189;;"Dampak kehandalan : 82P201 tidak ada spare, Dampak Operasional : apabila ada kegagalan dapat mengakibatkan stop unit "
05/08/2020;95/E14110/2020-S0 ;Cleaning 14E611 & 14E612;2101054877 & 2101054878;;;;;"Kenaikan temperatur inlet Hydrogen Purification Unit Tinggi hingga 480C (14TAHH277) menyebabkan HPU system trip, tidak ada supply H2 Permeate ke CCR, CCR Shutdown coking rate catalyst Unit Platforming naik. "
06/08/2020;100/E14110/2020-S0;Perbaikan percepatan Selenoid MAC Sewa Utilities Production I ;1101016104;8301080065;;500026282;;Dapat menurunkan kehandalan supply instrument Air Kilang Eksisting 
07/08/2020;097/E14110/2020-S5;Pengadaan Oil Skimmer dan Oil Boom HB 49 & HB 66;"Oil Skimmer 2101055030 , Oil Boom 2101055031";;;;;- Minyak yang ada di HB tidak dapat diambil dengan Oil Skimmer dan harus disedot menggunakan Vacuum Truck 
;;;;;;;;
11/08/2020;102/E14110/2020-S0 ;Percepatan Perbaikan Motor 053P101CM ;2101055084;;;;;"Dengan kondisi Motor 053P101CM Repair, maka status readiness dari Pompa Cooling Water Utilities 05 yaitu N+0 (no standby pump), jika terjadi kegagalan pada pompa Cooling Water Utilities 05 053P101AT/BT maka akan menyebabkan shutdown Kilang II (LOC II & FOC II) "
13/08/2020;103/E14110/2020-S0 ;"Percepatan Penggantian Floating Hose, Mooring Hawser dan Pengadaan MSL ";2101055257 dan 2101055259 ;;;;;- Kondisi tidak aman pada saat proses penyandaran dan discharge crude di SPM  
;;;;;;;;- Potensi penurunan Flow rate discharge crude karena menggunakan hanya 1 length floating hose 
;;;;;;;;- Potensi tumpahan minyak apabila tidak segera dilaksanakan penggantian 
13/08/2020;293/E14130/2020-S0;Perbaikan Bocoran di Flange Critical Flow Nozzle 30 Inchi di 101V-511 Unit 101 RFCC ;2101055285;8201030548;500026245;;;"Berakibat adanya kandungan CO di area lantai 4 RG RX yang berpotensi terpapar ke Pekerja dan Mitra Kerja yang melaksanakan pekerjaan di Area RG RX Unit 101 serta kerusakan flange critical flow nozzle 30 inchi berpotensi menyebabkan gangguan aliran flue gas yang mengalir ke COB (Carbon Monoksida Boiler) yang akan berdampak pada kegagalan Unit 101-RCU serta Unit RFCC total Shutdown yang mengakibatkan produksi offgas, gasoline, LPG, Propylene, LCO, dan DCO terhenti, produk HP Steam dari catalyst cooler hilang sebanyak kurang lebih 120 ton/hr berkurangnya produk HP Steam dari CO Boiler dari kurang lebih 210 ton / hr menjadi hanya kurang lebih 60 ton/hr, serta hilangnya produk MP steam dari Steam Generator sebanyak kurang lebih 70 ton/hr "
13/08/2020;297/E14120/2020-S5 ;Perbaikan 91K-402B ;1101016167;;;;;Unit 92 (LPG Recovery Unit) Stop 
14/08/2020;104/E14110/2020-S0;Pemasangan Scaffolding di line discharge 13P-6 ke header slope;2101055377;;;;;"Di daerah sekitra bocoran terdapat peralatan motor yang sedang beroperasi sehingga sangat berbahya bila tidak diperbaiki segera 2. Sementara buanagn 13V-7/8 di drain ke sewer, kandungan H2S tinggi mitigasi operasi di steaming."
18/08/2020;23/E14120/2020-S0;Cleaning 24E-32;2101055444;;;;;"Bila Vacum kondensor 24K-2 tinggi, hal ini akan menyebabkan 24K-2 trip , produk off dan MDU-1 harus Shutdown "
26/08/2020;109/E14110/2020-S0 ;Perbaikan Bocoran Line Crude di Inlet 11F-1;2101055613;;;;;"Shutdown Kilang CDU, HDT & Platformer FOC-1"
26/08/2020;110/E14110/2020-S0 ;Percepatan Perbaikan Shaft & Shaft Sleev Untk Rotating Equipment Utls ;"2101052809 ,2101052806, 2101052807, 2101054277,2101054623";8201029363;;;;Dapat Menurunkan Kehandalan Operasional Kilang 
;;;;;;;;
09/07/2020;84/E14110/2020 - S5;Percepatan Perbaikan Motor 013K-101 AM;;;;;;Apabila Recycle Gas Compressor 013K-101 BM saat ini mengalami kegagalan maka unit AHU akan Shutdown
08/07/2020;No.250/E14130/2020-S0;Perbaikan Pompa  COS (Carbonyl Sulfide) Circulation Pump 103P-509A;2101053884;;;;;"Dengan menunggu perbaikan impeller & shaft, Pompa COS Solvent tersebut beroperasi tanpa spare, berpotensi menyebabkan kegagalan sirkulasi COS Solvent yang akan berdampak pada kegagalan Unit 103 - Merox yang mengakibatkan kehilangan Produk LPG sebesar 1190 TPD & Propylene sebesar 475 TPD."
29/06/2020;No.228/E14130/2020-S0;Perbaikan FDF COB 101F-503K2;2101053425;8201029565;;;;"Dengan menunggu perbaikan carbon ring, FDF CO Boiler (combustion air) beroperasi tanpa spare, jika terjadi kegagalan pada 101F-503K1 (Motor) maka akan menyebabkan CO Boiler Trip sehingga steam balance terganggu, berakibat kapasitas RFCC turun (dibawah 100% kapasitas). Apabila kondisi ini tidak segera diselesaikan, maka berpotensi kehilangan produk Gasoline 92, LPG serta Propylene."
22/06/2020;No.223/E14130/2020-S0;Penggantian Solenoid 180-XV-605;;;;;;Dengan terkendalanya sinyal respon 180-XV-605 yang lemah mengakibatkan condensate masuk ke system PPU dan akan menurunkan life time mol.sieve di PPU.
17/06/2020;No.216/E14130/2020-S0;Penggantian Flame Detector di Aux Boiler (151-B-501B) UTL RFCC;2101051888 dan 2101052927;8201029268;;;;Dengan adanya kerusakan tersebut menyebabkan tidak maksimalnya operasional Aux Boiler B dan tidak termonitornya api di burner atas Aux Boiler B. Hal tersebut dapat mengganggu kehandalan kilang RFCC secara keseluruhan karena menurunnya produk steam dari Aux Boiler B.
21/04/2020;No./E14120/2020-S5;Perbaikan 024E-104C;;;;;;Potensi terjadinya Slow Down Unit 024 MEK Dewaxing Unit II
11/03/2020;No.89/E14130/2020-S0;Percepatan Perbaikan DPA Compressor 156K502BT;2101049329;8201027745;;;;"Dengan pola operasi saaat ini supply DA dan PA hanya dipenuhi dari 1 unit IA Compressor & 1 unit DPA Compressor, maka jika terjadi failed/kegagalan pada unit Compressor DPA (156K502A) akan berdampak hilangnya supply Dry Air ke Kilang RFCC yang akan mengakibatkan terganggunya operasional unit Catalyst Cooler. Guna mengatasi hal tersebut maka diharapkan untuk dapat segera dilakukan percepatan perbaikan/penggantian system actuator DPA Compressor 156K502BT."
17/02/2020;No.025/E14120/2020-S5;Recloth Vacuum Filter 240S-101 A dan B;;;;;;Bila vacuum filter dioperasikan dalam kondisi cloth robek/berlubang maka produk DO akan cloudy (Slack Wax terikut produk DO). Banyaknya spray nozzle yang buntu menyebabkan filtrasi tidak dapat optimal. Kondisi tersebut berakibat penurunan kapasitas unit MDU III untuk grade DAO kap 80% maks vs target 94% RK 2020 sehingga berdampak terjadi penurunan produk HVI 95 dan HVI 650.
17/02/2020;No.026/E14000/2008-S5;Fabrikasi Plunger Pompa 260P-104 AB;;;;;;"Pompa 260P-104A mengalami kebocoran dan 260P-104B flow minimum tidak tercapai. Meningkatkan potensi terjadinya korosi pada HP system Unit HTU jika flow wash water tidak memenuhi requirement. Bocoran pada Rod mengandung H2S konsentrasi tinggi diatas 10.000 ppm perpotensi unsafe condition. Dalam tempo 2 (dua) jam pompa tidak beroperasi, mengharuskan shut down unit agar tidak terjadi plugging di HP system."
07/02/2020;No.17/E14110/2019-S0;Perbaikan Motor;2101048281;8201026424;;;;Mengganggu Kehandalan dan Proses Operasi di area Kilang
07/02/2020;No.18/E14110/2019-S0;Perbaikan Motor;2101048282;8201026424;;;;Mengganggu Kehandalan dan Proses Operasi di area Kilang
07/02/2020;No.19/E14110/2019-S0;Perbaikan Motor;2101048294;;;;;Mengganggu Kehandalan dan Proses Operasi di area Kilang
31/01/2020;No.52/E14110/2019-S1;Perbaikan Intercooler Kompressor 156-K-501A E1 dan E2;;;;;;"Dengan tidak bisa beroperasinya Instrument Air Kompressor""A"" (156-K-501A), maka menyebabkan tidak ada kompresor yang standby sehingga bila ada kegagalan di Instrument Air Kompresor""B"" (156-K-501B) yang sedang operasi, maka pressure Header Instrument Air (normal 6,5 kg/cm2) akan melonjak turun dengan cepat yang dapat menyebabkan terganggunya proses di UTL RFCC"
;;;;;;;;
29/04/2020;/E14110/2020-S0;Percepatan Perbaikan Pompa Desuperheater 52P2A;2101051287;8201028578;;;;"Pompa 52P2B/C running untuk mensupply kebutuhan desuperheater water di 7 unit boiler di 50/05, FOC-I dan LOC-I, kondisi ini sangat mengganggu kehandalan desuperheater water supply ke seluruh area kilang RU-IV"
29/04/2020;080/E14170/2020-S5;Permohonan Addendum Waktu Tanpa Biaya Pekerja Perbaikan dan Pemeliharaan Pompa CPI PT PERTAMINA (PERSERO) RU IV Cilacap;;;;;;
18/08/2020;23/E14120/2019-S5;Cleaning 24E-32;2101055444;;;;;"Bila vacuum kondensor 24K-2 tinggi, hal ini akan menyebabkan 24K-2 trip, produk off dan MDU-I harus shutdown"
01/07/2020;360/E14110/2020-S0;Percepatan Perbaikan Catwalk 73MD( Dermaga III Area 70;1101015761;8301079234;;;;"Kondisi tidak aman pada saat proses penyandaran, terutama saat dilakukan malam hari, potensi kerusakan lebih besar pada struktur platform 73MD9 dan 73MD10 apabila tidak dilaksanakan pengangkatan dan reposisi Catwalk segera dan Potensi tidak dapat disandarkan kapal di Dermaga III."
21/01/2020;52/E14130/2020-S0;Perbaikan Intercooler Kompressor 156-K501A E1 dan E2;2101047948;8201026305;;;;"Dengan tidak beroperasinya Instrument Air Kompresor ""A"" (156-K-501A), maka menyebabkan tidak ada kompesor yang standby sehingga bila ada kegagalan di Instrument Air Kompresor ""B"" (156-K-501B) yang sedang operasi, maka pressure Header Instrument Air (normal 6,5 kh/cm) akan melonjak turun dengan cepat yang dapat menyebabkan terganggunya proses di UTL RFCC"
17/04/2020;144/E14130/2020-S0;Perihal Modifikasi Let Down HHP Steam UTL 500 to HP Steam UTL RFCC;;;;;;Emergecy stop unit Gasoline treating unit #105 dan Hidrogen Recovery Unit #108 untuk menjaga kestabilan pressure HP Steam Header dan Start Up RFCC secara overall 8 jam lebih lama terkait limitasi availabilitas HP Steam.
21/01/2020;/E14130/2020-S0;Line Injeksi Chemical Polisher 154A503;2101047538;;;;;"Produk/Outlet Polisher 154-A-503, akan mengalami offspec saat terlambat dilakukan proses regenerasi dan akan berdampak pada offspeknya Denim water di Kilang RFCC sehingga berpotensi pada kegagalan Boiler System maupun turbin-turbin di area Kilang RFCC-Produksi III "
30/03/2020;29/E14110/2020-S0;Low Performant 56K3 dan 56K102;;;;;;"Dengan kondisi Kompressor Trip, kehandalan Supply Air Instrument terganggu"
13/04/2020;003/E14110/2020-S5;Pembuatan Line LCO Export ke 33T8;;;;;;"33T8 tidak dapat menampung produk Lco Export, Dengan tidak adanya tanki penampung LCO Export maka program produksi LCO Export menjadi tidak bisa terlaksana dan Ketidaksiapan 33T8 mengakibatkan LCO Export dimasukkan ke tanki MFO sehingga menjadi down grade produk"
26/05/2020;62/E14110/2020-S0;Pekerjaan Penanggulangan Bocoran Tanki 71T3 di Oil Movement 70;;;;;;"Unsafe Condition (potensi flash/kebakaran dan pencemaran lingkungan baik tanah, air dan udara, dampak sosial (tuntutan masyarakat sekitar dan LSM), dan dampak operasional berkurangnya tanki timbun crude oil."
14/08/2020;104/E14110/2020-S0;Pemasangan Scaffolding di line discharge 13P-6 ke header slope;2101055377;;;;;"Dampak safety dan lingkungan karena di daerah sekitar bocoran terdapat peralatan motor yang sedang beroperasi sehingga sangat berbahaya bila tidak diperbaiki segera dan sementara buangan 13V-7/8 di drain ke sewer, kandungan H2S tinggi mitigasi operasi di steaming."
04/06/2020;154/E14110/2020-S0;Pembubutan Cover Outboard Bearing 11P-4B;;;;;;"Bila 11P-4A mengalami kegagalan, maka Unit CDU harus stop"
04/06/2020;/E14120/2020-S0;Pembuatan Jumper Line dari tangki 39T-202 ke tangki 39T-209;2101052444;;;;;"Dampak Kehandalan: tidak dapat menampung produk Heavy Platformate sebagai umpan unit Xylene Fraksinasi. Dampak Operasional: dapat mengakibatkan terganggunya unit proses Area C di KPC (unit 87 Xylene Fraksinasi), dan pemakaian N2 yang banyak. Dampak safety: Unsafe condition dan paparan hydrocarbon, karena tangki 39T-202 sudah dalam kondisi abnormal (atap dalam kondisi terbuka/rusak)"
22/07/2020;264/E14120/2020-S5;Pengadaan UPS (uninterruptible Power Supply) pengganti UPS 200EE0004 dan battery bank 200EE0005;;;;;;All unit LOC III shutdown akibat power dailure PLC ESD dari kegagalan Secondary UPS 200EE0004 yang beroperasi tanpa adanya Standby UPS
30/04/2020;96/E14110/2020-S0;Penggantian Rocksalt di 16C-2;2101050612;8201028286;;;;Target produksi avtur tidak bisa tercapai
02/03/2020;036/E14120/2020-S5;Penggantian Control Valve Assy 22LV-011 (level control BFW di 22V-2 untuk Asphalt Cooler 22E-8;2101048775;8201030955;;;;"Vapor dan kondensat BFW bocor keluar dari packing dan Bonnet 22LV-011, Aliran BFW ke 22V-2 tidak bisa dicontrol (CV passing), Bila level 22V-2 tinggi BFW direlease keluar menyebabkan losses dan kondisi tidak aman (press 80kg/cm/temp 140C)"
02/03/2020;038/E14120/2020-S5;Perbaikan pompa torak 24P-14;2101040453;8201022215;;;;"Solvent dari Underground Vessel 24V-10 tidak dapat dipompakan ke 24V-7 untuk direcovery ke system, potensi losses Solvent. Solvent dari kegiatan warm wash yang ditampung di 24V-7 dipompakan ke Recovery system menggunakan 24P-5. Bila 24P-5 fail, terjadi losses Solvent/tidak bisa direcovery. Durasi drying Solvent pada saat start up lebih lama, limitas pada kapasitas 24P-5"
27/02/2020;035/E14120/2020-S5;Perbaikan Scroll Vacuum Drum Filter 24S-1A;;;;;;Slowdown capasity unit MDU-I berpotensi Shutdown Unit dan Target RPH dan STS unit MDU tidak terpenuhi
02/03/2020;037/E14120/2020-S5;Penggantian 23LT-008 Assy (level interface Decanter 23V-3);2101048776;;;;;Potensi air masuk ke system recovery Furfural dan Furfural terikut ke water side 23V-3 menyebabkan losses Furfural
01/07/2020;243/E14130/2020-S0;Penggantian Valve Discharge Pompa Clarifier 63-P-502ABC;"2101053543, 2101053544, 2101053545";8201030521;;;;"Berdasarkan kerusakan tersebut dapat menyebabkan terganggunya operational pada saat kejadian emergency dikarenakan operator kesulitan dalam mengoperasikan valve tersebut. Dan selain unsafe condition saat mengoperasikan valve khususnya 63-P-502C, juga dapat kami sampaikan terkait kendala pada saat cleaning strainer karena kondisi valve passing"
06/03/2020;/E14130/2020-S0;Perbaikan Actuator Kompressor 156-K-502B;2101049329;8201027745;;;;"Dengan kerusakan actuator DPA B tersebut menyebabkan tidak ada compressor DPA yang standby, hal tersebut akan mengganggu kehandalan operasi kilang RFCC jika terjadi gangguan pada compressor DPA A yang sedang beroperasi."
27/05/2020;61/E14110/2020-S0;Perbaikan Bearing Motor 11P-4B;2101052196;;;;;"Bila 11P-4A mengalami kegagalan, maka Unit CDU harus Stop"
31/01/2020;053/E14130/2020-S5;Permintaan Kerja urgent perbaikan Fireproofing area 47 Selatan;2101047981;;;;;"Dengan tidak diperbaikinya fireproofing pada support tangki LPG dan Propylene berpotensi menyebabkan kerusakan yang parah jika terjadi kebakaran dan Hal itu terjadi akibat kerusakan konstruksi karena panas yang dapat meruntuhkan pipe support yang menahan beban berat (tangki, perpipaan dan aksesoris lainnya)"
03/07/2020;/E14130/2020-S0;Perbaikan Governor Cooling Water Pump 153-P-501A;2101052309;8201029111;;;;"Dengan hanya dapat dioperasikan 2 unit pompa Cooling Water 153-P-501 B/C dalam memenuhi kebutuhan air pendingin, maka berpotensi menurunkan kehandalan supply cooling water kilang RFCC"
07/02/2020;17/E14110/2019-S0;Perbaikan Motor;2101048281;8201026424;;;;Mengganggu Kehandalan dan Proses Operasi di area Kilang
07/02/2020;18/E14110/2020-S0;Perbaikan Motor;2101048282;8201026424;;;;Mengganggu Kehandalan dan Proses Operasi di area Kilang
30/03/2020;/E14130/2020-S0;Perbaikan Motor Evaporator HVAC 100-BD-602;;;;;;"Apabila Evaporator HVAC 100-BD-602 yang saat ini mengalami kegagalan, maka dapat mengakibatkan overheat pada gedung DCS, SS, dan gedung LK3 dan merusak sistem elektronik di gedung CR"
17/03/2020;99/E14130/2020-S0;Perbaikan MOV Spillback Pompa Propylene 47-MOV-044;2101049738;;;;;Dengan terkendalanya valve 47-MOV-044 berpotensi menyebabkan kerusakan pada pompa offspec propylene 47-P-512 A/B dikarenakan spillback minimum flow tidak tercapai
07/02/2020;/E14110/2019-S0;Perbaikan pompa ;;;;;;Mengganggu kehandalan dan Proses Operasi di area Kilang
