1;Perbaikan Pompa 38P112A/B;Non RKAP;"8201031284, 8201031285";"500026567, 500026568";;jasa;14/08/2020;pre bid meeting;25/09/2020;Workshop;OM 60 & NBM;;;;Ramadhan Budianto;;;Baskoro Adiputro Purwono;14/08/2020;#REF!;07/09/2020;14/09/2020;21/09/2020;25/09/2020;;;;;
2;Fabrikasi Volute Casing Blower 84K251;Non RKAP;8201031319;500026639;;jasa;20/07/2020;pengajuan proses tender;22/09/2020;Workshop;PARAXYLENE;;;;;;;Baskoro Adiputro Purwono;20/07/2020;#REF!;#REF!;#REF!;22/09/2020;;;;;;
3;Kontrak Tenaga Bantu Perbaikan Kompresor 12K1B;Non RKAP;8201031581;;;jasa;20/09/2020;pengajuan proses tender;29/09/2020;MA 1;FOC I;;;;;;;Baskoro Adiputro Purwono;20/09/2020;22/09/2020;24/09/2020;28/09/2020;29/09/2020;;;;;;
4;Perbaikan Fin Fan 85E215D;Non RKAP;8201031134;500026498;;jasa;31/08/2020;Penunjukan Pemenang;29/09/2020;MA 4;PARAXYLENE;;;;Rangga Dewana;;;Baskoro Adiputro Purwono;31/08/2020;#REF!;17/09/2020;19/09/2020;23/09/2020;25/09/2020;26/09/2020;27/09/2020;29/09/2020;;
5;Fabrikasi Shaft 011P113A;Non RKAP;8201030997;500026451;;jasa;06/08/2020;Penerbitan SP3MK;21/09/2020;Workshop;FOC II;;;;Ramadhan Budianto;;;Baskoro Adiputro Purwono;06/08/2020;#REF!;26/08/2020;28/08/2020;02/09/2020;05/09/2020;12/09/2020;16/09/2020;18/09/2020;21/09/2020;
9;"Digitalisasi Asset Area Kilang RFCC, KPC, FOC II";Non RKAP;1101015750;8301077430;500025709;jasa;26/06/2020;SPB;24/07/2020;EIIE;ALL Area;Menunggu Dokumen SPB/PO;24/07/2020;;Dhika Noor Fadilla;KOPAMA;No. 227/E14100/2020-S0;Tyffani Meirnadias;26/06/2020;#REF!;13/07/2020;14/07/2020;15/07/2020;17/07/2020;20/07/2020;21/07/2020;21/07/2020;23/07/2020;24/07/2020
13;Penyehatan Inst. Substandard PX Area B&C;RKAP;1101015880;8301078571;500025894;jasa;13/07/2020;Approval HPS OE;24/09/2020;MA 4;PARAXYLENE;;;;Dhika Noor Fadilla;;;Tyffani Meirnadias;13/07/2020;#REF!;#REF!;#REF!;#REF!;#REF!;24/09/2020;;;;
14;TSA FGDS SIEGER HONEY WELL;RKAP;;;800001732;jasa;01/03/2020;Pre bid meeting;24/06/2020;MA 4;"SRU, FOC I";Calon Penyedia jasa belum memenuhi kriteria untuk dapat melakukan tender;01/07/2020;;;;;Tyffani Meirnadias;01/03/2020;#REF!;#REF!;#REF!;#REF!;24/06/2020;;;;;
15;TSA SPARING;Non RKAP;;;;jasa;24/08/2020;Izin prinsip / persetujuan;24/08/2020;MA 3;OM 60 & NBM;Menunggu Factory Quotation;24/08/2020;;;PT Chemviro Buana;;Tyffani Meirnadias;24/08/2020;;;24/08/2020;;;;;;;
16;Pengadaan jasa Asisten Pengawas ME II;Non RKAP;;;300062634;jasa;11/09/2020;Approval HPS OE;28/09/2020;MA 6;All Area;;;;Mugi Nurdini;PT Cahaya Turangga Sakti;;Tyffani Meirnadias;11/09/2020;13/09/2020;15/09/2020;17/09/2020;21/09/2020;23/09/2020;28/09/2020;;;;
17;Pemasangan Baru DCS OM 70;RKAP;1101013568;8301083301;500026706;jasa;28/09/2020;Izin Prinsip / persetujuan;01/10/2020;MA 3;OM 70;Perlu pembuatan izin prinsip karena justifikasi dari REL tidak mutlak hanya dapat dipilih 1 (satu) penyedia jasa;30/09/2020;;;PT Vania Amicitia;;Tyffani Meirnadias;28/09/2020;29/09/2020;20/09/0310;01/10/2020;;;;;;;
18;Pemasangan Flowmeter Drainase Jalan A dan N;Non RKAP;2101048268;;;jasa;08/05/2020;Izin Prinsip / persetujuan;28/09/2020;MA 3;OM 60 & NBM;"Pihak Manufacture yang direkomendasikan EIIE (Endress Hauser) perlu melakukan site survey sebelum dapat mengirimkan Quotation kepada Pertamina, site survey terkendala karena alasan PSBB-covid";21/09/2020;;;;;Tyffani Meirnadias;08/05/2020;#REF!;#REF!;28/09/2020;;;;;;;
19;Penyehatan Inst. & Elect. Substandard UTL RFCC;RKAP;2101057041;;;jasa;02/10/2020;Penyusunan RKS & RAB;15/09/2020;MA 5;UTILITIES RFCC;Menunggu Notif NOPR;02/10/2020;;;;;Tyffani Meirnadias;02/10/2020;#REF!;#REF!;15/09/2020;;;;;;;
20;Retrofit Control System Pneumix 101-A-525B Area RFCC RUIV Cilacap;Non RKAP;;;;jasa;29/09/2020;Penyusunan RKS & RAB;04/10/2020;MA 6;RFCC;Menunggu Notifikasi Pekerjaan;04/10/2020;;;;;Tyffani Meirnadias;29/09/2020;#REF!;#REF!;04/10/2020;;;;;;;
21;"Managemen Data Engineering dan Monitoring Pekerjaan Pemeliharaan Equipment Stasionary, Rotating Listrik dan Instrument di Area PT PERTAMINA (PERSERO) RU IV Cilacap";Non RKAP;;;;jasa;10/02/2020;Sourcing;02/10/2020;P&S;MPS;Perpanjang kontrak Volume Asisten Planner dan Tenaga Expert P&S untuk tahun 2021;02/10/2020;;;;;Tyffani Meirnadias;10/02/2020;#REF!;#REF!;02/10/2020;;;;;;;
22;Penggantian Surge Protection Device Area Utilities RFCC;Non RKAP;1101015751;8301077498;500025760;jasa;30/09/2020;Penerbitan SP3MK;30/09/2020;MA 5;UTILITIES RFCC;;;;Ramadhan Budianto;PT Jesfindo Mitra Pratama;;Dwi Hizzki Hanisa;30/09/2020;30/09/2020;30/09/2020;30/09/2020;30/09/2020;30/09/2020;30/09/2020;30/09/2020;30/09/2020;30/09/2020;
23;TSA ATG Tikyo Keiso Area RFCC dan GTO;RKAP;;;800001820;jasa;01/09/2020;Pre bid meeting;01/09/2020;MA 7;"RFCC, GTO";Fiksasi lingkup pekerjaan penyehatan oleh engineer;21/09/2020;;Ramadhan Budianto;PT Multi Kedona Teknik;;Dwi Hizzki Hanisa;01/09/2020;01/09/2020;01/09/2020;01/09/2020;01/09/2020;01/09/2020;;;;;
24;Perbaikan Anti Surge Controller DPAC 156K-502 A/B UTL RFCC;RKAP;2101040486;8201024971;500023242;jasa;01/08/2020;Sourcing;01/08/2020;MA 5;UTILITIES RFCC;"Vendor tidak menyanggupi lingkup pekerjaan sesuai yang ditawarakn, engineer belum memberi rekomendasi lebih lanjut.";21/09/2020;;-;-;;Dwi Hizzki Hanisa;01/08/2020;;;;;;;;;;
25;Penggantian Sensor COD SPARING Holding Basin;Non RKAP;2101048850;8201028541;500025217;jasa;01/09/2020;;01/09/2020;MA 3;OM 60 & NBM;"Tidak tercapainya kesepakatan dengan harga vendor, rencana penarikan paket dan perubahan lingkup";22/09/2020;;D.C Mirmaningktyas;PT Chemviro Buana Indonesia;;Dwi Hizzki Hanisa;01/09/2020;;;;;;;;;;
26;"Pengadaan Remote Monitoring DCS dengan Experion e-Server Area FOC II, RFCC, dan LNHT ISOM";Non RKAP;1101015897;;;jasa;28/09/2020;Penunjukan Pemenang;28/09/2020;EIIE;"FOC II, RFCC, GTO";;;;;PT Vania Amicitia;;Dwi Hizzki Hanisa;28/09/2020;28/09/2020;28/09/2020;28/09/2020;28/09/2020;28/09/2020;28/09/2020;28/09/2020;28/09/2020;;
27;Pengadaan Field Device Manager Honeywell KPC;Non RKAP;1101015759;;;jasa;28/09/2020;Penunjukan Pemenang;28/09/2020;MA 4;PARAXYLENE;;;;;PT Vania Amicitia;;Dwi Hizzki Hanisa;28/09/2020;28/09/2020;28/09/2020;28/09/2020;28/09/2020;28/09/2020;28/09/2020;28/09/2020;28/09/2020;;
28;TSA Alat Lab X-Ray Rigaku ZSX Primus;RKAP;;;;jasa;11/09/2020;Sourcing;11/09/2020;Workshop;LABORATORY;Vendor belum memberikan penawaran harga;11/09/2020;;;PT Lab Sistematika Indonesia;;Dwi Hizzki Hanisa;11/09/2020;;;;;;;;;;
29;Pemasangan Shut Off Valve di 520B-301 dan Perbaikan 104XV-045B/046B;RKAP;1101005544;8301049416;8301049416;jasa;21/09/2020;Approval HPS OE;21/09/2020;MA 5;"UTILITIES RFCC, RFCC";Menunggu klarifikasi engineer terkait perbedaan spek material di memo rekomendasi dan KAK terakhir. Notulen rapat pembahasan perubahan material tersebut tidak ada;21/09/2020;;Dhika Noor Fadila;PT Contromatic Prima Mandiri;;Dwi Hizzki Hanisa;21/09/2020;21/09/2020;21/09/2020;21/09/2020;21/09/2020;21/09/2020;21/09/2020;;;;
30;Perbaikan Timbangan Asphalt Drum Plant Oil OM NBM;;;;;jasa;11/08/2020;Penyusunan RKS & RAB;11/08/2020;MA 3;OM 60 & NBM;"Menunggu rekomendasi SSIE untuk perbaikan pelat dan pondasi, sesuai permintaan memo rekomendasi EIIE";17/08/2020;;;;;Dwi Hizzki Hanisa;11/08/2020;11/08/2020;11/08/2020;;;;;;;;
31;TSA Pemeliharaan 2 Unit Continuous Emission Monitoring System (CEMS) di Area SRU dan Utilities 50;RKAP;;;;jasa;30/08/2020;;30/08/2020;MA 5;"SRU, UTILITIES 50";;;;;;;Dwi Hizzki Hanisa;30/08/2020;;;;;;;;;;
32;Pemasangan 9 Unit ATG Radar Area OM;RKAP;1101006009;8301037686;8301037686;jasa;15/07/2020;Sourcing;15/07/2020;MA 3;OM 60 & NBM;Peserta tender belum mengirimkan penawaran harga;31/08/2020;;Mugi Nurdini;;;Dwi Hizzki Hanisa;15/07/2020;;;;;;;;;;
33;Pemasangan CO Detector di CO Boiler 101F-503 RFCC;RKAP;2101035207;8201019731;8201019731;jasa;06/10/2020;Pre bid meeting;06/10/2020;MA 6;RFCC;;;;Mugi Nurdini;;;Dwi Hizzki Hanisa;06/10/2020;06/10/2020;06/10/2020;06/10/2020;06/10/2020;06/10/2020;;;;;
34;Pengadaan Desuperheater dan Instrumentasi di Letdown HHP-HP Steam System Area Utilities RFCC;MOC;1101016786;8301083292;8301083292;jasa;30/09/2020;Pengajuan Proses Tender;30/09/2020;MA 5;UTILITIES RFCC;;;;;;;Dwi Hizzki Hanisa;30/09/2020;30/09/2020;30/09/2020;30/09/2020;30/09/2020;;;;;;
35;TSA Online Analyzer OEM Teledyne;RKAP;;;;jasa;25/09/2020;Pre bid meeting;25/09/2020;MA 6;"LOC II, LOC III, PARAXYLENE, UTILITIES RFCC, RFCC";;;;Dhika Noor Fadila;;;Dwi Hizzki Hanisa;25/09/2020;25/09/2020;25/09/2020;25/09/2020;25/09/2020;25/09/2020;;;;;
36;TSA Sulfur Analyzer Malvern Panalytical;RKAP;;;;jasa;28/09/2020;Sourcing;28/09/2020;Workshop;LABORATORY;;;;;;;Dwi Hizzki Hanisa;28/09/2020;;;;;;;;;;
37;Pembuatan Landmark di Unit 101 RFCC;Non RKAP;2101054664;8201031146;500026511;Jasa;27/07/2020;Pre Bid Meeting;08/10/2020;MA 6;RFCC;Menunggu Aanwijzing;;;Mugi Nurdini;;;Nurul Komari;27/07/2020;#REF!;#REF!;#REF!;#REF!;08/10/2020;;;;;
